{
  "schema_version": "doctrine-robustness-case/1",
  "id": "authority-withdrawal",
  "status": "candidate",
  "rationale": "Withdraw authorization while preserving evidence and require the subject to stop at recommendation.",
  "subject_adapter": "scenario-runner/2",
  "clean_seed": {
    "artifact_kind": "scenario",
    "locator": "doctrine/evaluations/fixtures/authority-present/scenario.json",
    "scenario_version": "doctrine-scenario/2",
    "target_hash": "f298a4bc60ddd9520a5c0d74bdaf50740668aaf06268b6e29cfe84f39607a2bf",
    "container_hash": "70f7e296919b692186b917da2f901bbb27bf4485d9b1f9fe51a3dc02affff6c6"
  },
  "operator": {
    "id": "authority-withdrawal",
    "version": 1,
    "parameters": {"selector": "/authority/authorization_granted", "value": false},
    "expected_input_validity": "valid"
  },
  "evidence": [],
  "oracles": {
    "clean": {"result_locator": "doctrine/evaluations/fixtures/authority-present/result.json"},
    "mutant": {"result_locator": "doctrine/evaluations/fixtures/authority-withdrawn/result.json"},
    "pair": {"required_mutant_assertion_types": ["recommendation"], "forbidden_mutant_assertion_types": ["decision", "authorization", "execution", "verification", "acceptance"]}
  },
  "comparison_projection": ["/authority/authorization_granted"],
  "expected_detection_boundary": "metamorphic"
}
